{
  "registryVersion": "1.1.0",
  "updatedAt": "2026-07-14T21:45:00+10:00",
  "productionMode": "reconstruction",
  "generationPolicy": {
    "caseSentence": "This case trains [phase purpose] through [pattern], using [station task], to prevent [failure mode], while introducing [new surprise].",
    "admissionQuestions": [
      "Which pattern does this case belong to?",
      "What exact AMC-style task is being tested?",
      "What clinical or performance failure could occur?",
      "What new surprise makes this case different?",
      "What must the learner be able to do after this case?",
      "Does an existing case already train the same job?"
    ],
    "variationSources": [
      "subtle presentation",
      "dangerous mimic or overlap",
      "patient resistance",
      "falsely reassuring investigation",
      "different task or recipient",
      "time pressure",
      "recovery after an initially wrong direction"
    ],
    "reserveRule": "Open a reserve only when it adds a distinct surprise, addresses a demonstrated weakness or receives explicit approval. Merge or retain it as a reserve when an existing case already trains the same job.",
    "missingLogicRule": "A pattern with missing pattern-specific logic cannot enter generation. Its objective, central capability and core coverage must be deliberately designed and source-reviewed first.",
    "namePolicy": "Use varied, realistic and pronounceable names found in Australian practice. Do not use a name as a cultural stereotype or diagnostic clue, and do not repeat a first name from the previous twenty cases unless continuity is intentional and recorded."
  },
  "phases": [
    {
      "id": 1,
      "title": "Can Kill Fast",
      "internalFunction": "Catastrophic Control",
      "purpose": "Recognise danger and act before diagnostic certainty.",
      "patternIds": [
        1,
        2,
        3,
        4,
        5,
        6,
        7,
        8,
        9,
        10,
        11,
        12
      ]
    },
    {
      "id": 2,
      "title": "Dangerous Mimics",
      "internalFunction": "Differentiation Control",
      "purpose": "Compare close alternatives without premature closure.",
      "patternIds": [
        13,
        14,
        15,
        16,
        17,
        18,
        19,
        20,
        21,
        22
      ]
    },
    {
      "id": 3,
      "title": "Common Stations",
      "internalFunction": "System Depth",
      "purpose": "Build reliable performance in common clinical stations.",
      "patternIds": [
        23,
        24,
        25,
        26,
        27,
        28,
        29,
        30,
        31,
        32
      ]
    },
    {
      "id": 4,
      "title": "Hard Conversations",
      "internalFunction": "High Communication",
      "purpose": "Communicate risk, uncertainty and difficult decisions safely.",
      "patternIds": [
        33,
        34,
        35,
        36,
        37,
        38,
        39,
        40
      ]
    }
  ],
  "patterns": [
    {
      "id": 1,
      "phaseId": 1,
      "title": "Dangerous Chest Pain",
      "status": "legacy_reconstruction_required",
      "initialCore": 3,
      "maximumWithoutExpansion": 5,
      "objective": "Recognise danger and act before diagnostic certainty.",
      "dominantCapability": "Distinguish immediately dangerous cardiothoracic causes and enter the correct pathway before certainty.",
      "coreCoverage": [
        "dangerous cardiac pattern",
        "aortic dissection",
        "pulmonary embolism",
        "tension pneumothorax"
      ],
      "reserves": [
        "normal first ECG with ongoing concern",
        "atypical acute coronary syndrome in diabetes",
        "pericarditis overlap",
        "reflux overlap"
      ],
      "expansionRule": "Open a reserve only when it adds a distinct recognition or safety decision not already trained by the four legacy cases.",
      "logicProvenance": "recovered_from_uploaded_systems",
      "generationStatus": "reconstruction_only"
    },
    {
      "id": 2,
      "phaseId": 1,
      "title": "Acute Shortness of Breath",
      "status": "legacy_reconstruction_required",
      "initialCore": 3,
      "maximumWithoutExpansion": 5,
      "objective": "Recognise danger and act before diagnostic certainty.",
      "dominantCapability": "Recognise respiratory deterioration and choose cause-specific first treatment.",
      "coreCoverage": [
        "severe asthma",
        "anaphylaxis",
        "acute heart failure",
        "COPD with oxygen and hypercapnia safety"
      ],
      "reserves": [],
      "expansionRule": "The fourth legacy case is justified by a distinct oxygen-safety decision. Further expansion requires a new central decision.",
      "logicProvenance": "recovered_from_uploaded_systems",
      "generationStatus": "reconstruction_only"
    },
    {
      "id": 3,
      "phaseId": 1,
      "title": "Sudden Neurological Deficit",
      "status": "legacy_reconstruction_required",
      "initialCore": 3,
      "maximumWithoutExpansion": 5,
      "objective": "Recognise danger and act before diagnostic certainty.",
      "dominantCapability": "Preserve the neurological time anchor while checking reversible mimics and haemorrhage.",
      "coreCoverage": [
        "wake-up stroke",
        "hypoglycaemic mimic",
        "intracerebral haemorrhage"
      ],
      "reserves": [],
      "expansionRule": "Expand only for a distinct neurological time-critical decision not covered by stroke, mimic or haemorrhage.",
      "logicProvenance": "recovered_from_uploaded_systems",
      "generationStatus": "reconstruction_only"
    },
    {
      "id": 4,
      "phaseId": 1,
      "title": "Sepsis Pattern",
      "status": "legacy_reconstruction_required",
      "initialCore": 3,
      "maximumWithoutExpansion": 5,
      "objective": "Recognise danger and act before diagnostic certainty.",
      "dominantCapability": "Recognise organ dysfunction, reassess response and account for high-risk hosts.",
      "coreCoverage": [
        "occult-source sepsis with delirium",
        "persistent septic shock after fluid",
        "neutropenic sepsis"
      ],
      "reserves": [],
      "expansionRule": "Expand only when a host, source or treatment decision cannot be absorbed into the existing sepsis ladder.",
      "logicProvenance": "recovered_from_uploaded_systems",
      "generationStatus": "reconstruction_only"
    },
    {
      "id": 5,
      "phaseId": 1,
      "title": "Shock Pattern",
      "status": "legacy_reconstruction_required",
      "initialCore": 3,
      "maximumWithoutExpansion": 5,
      "objective": "Recognise danger and act before diagnostic certainty.",
      "dominantCapability": "Differentiate concealed blood loss, pump failure and loss of vascular tone before selecting resuscitation.",
      "coreCoverage": [
        "occult pelvic haemorrhage",
        "cardiogenic shock from myocarditis",
        "neurogenic shock"
      ],
      "reserves": [],
      "expansionRule": "Expand only for a shock mechanism or resuscitation decision not trained by the existing ladder or other Phase 1 patterns.",
      "logicProvenance": "recovered_from_uploaded_systems",
      "generationStatus": "reconstruction_only"
    },
    {
      "id": 6,
      "phaseId": 1,
      "title": "Unstable Gastrointestinal Bleed",
      "status": "legacy_reconstruction_required",
      "initialCore": 3,
      "maximumWithoutExpansion": 5,
      "objective": "Recognise danger and act before diagnostic certainty.",
      "dominantCapability": "Match physiology and likely source to the appropriate resuscitation and source-control pathway.",
      "coreCoverage": [
        "non-variceal upper gastrointestinal bleed",
        "variceal haemorrhage",
        "major haematochezia during factor-Xa inhibition"
      ],
      "reserves": [
        "aortoenteric fistula after aortic graft surgery"
      ],
      "expansionRule": "Keep generic shock and early-haemoglobin traps inside core cases. Open the reserve only for its distinct catastrophic clue.",
      "logicProvenance": "recovered_from_uploaded_systems",
      "generationStatus": "reconstruction_only"
    },
    {
      "id": 7,
      "phaseId": 1,
      "title": "Metabolic Collapse",
      "status": "legacy_reconstruction_required",
      "initialCore": 3,
      "maximumWithoutExpansion": 5,
      "objective": "Recognise danger and act before diagnostic certainty.",
      "dominantCapability": "Identify the controlling metabolic process and apply treatment in the correct sequence.",
      "coreCoverage": [
        "diabetic ketoacidosis",
        "hyperosmolar hyperglycaemic state",
        "ECG-toxic hyperkalaemia"
      ],
      "reserves": [
        "euglycaemic ketoacidosis",
        "adrenal crisis",
        "severe symptomatic hyponatraemia",
        "hypercalcaemic crisis",
        "mixed diabetic ketoacidosis and hyperosmolar state"
      ],
      "expansionRule": "Open a reserve only when its first treatment sequence adds a central decision not trained by the three core pathways.",
      "logicProvenance": "recovered_from_uploaded_systems",
      "generationStatus": "reconstruction_only"
    },
    {
      "id": 8,
      "phaseId": 1,
      "title": "Cardiac Syncope",
      "status": "legacy_reconstruction_required",
      "initialCore": 3,
      "maximumWithoutExpansion": 5,
      "objective": "Recognise danger and act before diagnostic certainty.",
      "dominantCapability": "Separate structural risk, fast rhythm and slow rhythm despite recovery between events.",
      "coreCoverage": [
        "hypertrophic cardiomyopathy risk",
        "intermittent ventricular tachycardia",
        "intermittent complete heart block"
      ],
      "reserves": [
        "severe aortic stenosis",
        "inherited channelopathy or convulsive syncope"
      ],